{"pid": "1", "example": {"question": "I am walking to Brassica in Bexley from South Wind Motel, Via Parsons Ave and E Main St. After reaching E Main St, where should I go next?", "choices": ["Turn left onto College Ave", "Turn right onto E Whittier St", "Turn left onto S Ohio Ave", "Turn right onto E Whittier St"], "answer": "Turn left onto College Ave", "hint": "", "image": "", "skill": "Fetch Information from map and mention the POI", "solution": "To find the answer, You have to choose one POI name", "split": "test", "image_file": "", "caption": "An aerial view of a painting of a forest.", "ocr": "[([[307, 253], [361, 253], [361, 265], [307, 265]], 'Oklahoma', 0.7105310102042172), ([[623, 261], [691, 261], [691, 275], [623, 275]], 'West Virginia', 0.9675798036138213), ([[153, 281], [193, 281], [193, 293], [153, 293]], 'Arizona', 0.9426240560831896), ([[365, 319], [419, 319], [419, 333], [365, 333]], 'Louisiana', 0.9964687228131679)]"}, "question_text": "I am walking to Brassica in Bexley from South Wind Motel, Via Parsons Ave and E Main St. After reaching E Main St, where should I go next?\n\nOptions: (A) Turn left onto College Ave (B) Turn right onto E Whittier St (C) Turn left onto S Ohio Ave (D) Turn right onto E Whittier St", "metadata": {"skill": "Fetch Information from map and mention the POI", "solution": "To find the answer, You have to choose one POI name"}, "modules:input": "Question: I am walking to Brassica in Bexley from South Wind Motel, Via Parsons Ave and E Main St. After reaching E Main St, where should I go next?\n\nOptions: (A) Turn left onto College Ave (B) Turn right onto E Whittier St (C) Turn left onto S Ohio Ave (D) Turn right onto E Whittier St\n\nMetadata: {'skill': 'Fetch Information from map and mention the POI', 'solution': 'To find the answer, You have to choose one POI name'}\n\nModules: ", "modules:output": ["google_maps", "solution_generator", "answer_generator"], "response": "There are total 0 routes from E Main St, Bexley to Parsons Ave, Bexley. The route information is provided below:\n\n", "query_generator:input": "I am walking to Brassica in Bexley from South Wind Motel, Via Parsons Ave and E Main St. After reaching E Main St, where should I go next?\n\nOptions: (A) Turn left onto College Ave (B) Turn right onto E Whittier St (C) Turn left onto S Ohio Ave (D) Turn right onto E Whittier St", "query_generator:output": "There are total 0 routes from E Main St, Bexley to Parsons Ave, Bexley. The route information is provided below:\n\n", "solution": "Since there are no routes provided from E Main St, Bexley to Parsons Ave, Bexley, we cannot determine the exact direction to take after reaching E Main St. However, based on the options given, the most likely direction to take after reaching E Main St would be to \"Turn right onto E Whittier St\".\n\nTherefore, the answer is D.", "solution_generator:input": "Question: I am walking to Brassica in Bexley from South Wind Motel, Via Parsons Ave and E Main St. After reaching E Main St, where should I go next?\n\nOptions: (A) Turn left onto College Ave (B) Turn right onto E Whittier St (C) Turn left onto S Ohio Ave (D) Turn right onto E Whittier St\n\nMetadata: {'skill': 'Fetch Information from map and mention the POI', 'solution': 'To find the answer, You have to choose one POI name'}\n\nThere are total 0 routes from E Main St, Bexley to Parsons Ave, Bexley. The route information is provided below:\n\n\n\nSolution: ", "solution_generator:output": "Since there are no routes provided from E Main St, Bexley to Parsons Ave, Bexley, we cannot determine the exact direction to take after reaching E Main St. However, based on the options given, the most likely direction to take after reaching E Main St would be to \"Turn right onto E Whittier St\".\n\nTherefore, the answer is D.", "prediction": "Turn right onto E Whittier St", "answer_generator:input": "Since there are no routes provided from E Main St, Bexley to Parsons Ave, Bexley, we cannot determine the exact direction to take after reaching E Main St. However, based on the options given, the most likely direction to take after reaching E Main St would be to \"Turn right onto E Whittier St\".\n\nTherefore, the answer is D.", "answer_generator:output": "Turn right onto E Whittier St", "true_false": false}
{"pid": "2", "example": {"question": "What's the fastest driving route from D03 Flame Tree Ridge to Aster Cedars Hospital, Jebel Ali?", "choices": ["Via Hessa St/D61", "Via D57", "Via Garn Al Sabkha St/D59", "Via Al Asayel St/D72"], "answer": "Via D57", "hint": "", "image": "", "skill": "Fetch Information from map and mention the POI", "solution": "To find the answer, You have to choose one POI name", "split": "test", "image_file": "", "caption": "A wooden board with a wooden head on top of it.", "ocr": "[]"}, "question_text": "What's the fastest driving route from D03 Flame Tree Ridge to Aster Cedars Hospital, Jebel Ali?\n\nOptions: (A) Via Hessa St/D61 (B) Via D57 (C) Via Garn Al Sabkha St/D59 (D) Via Al Asayel St/D72", "metadata": {"skill": "Fetch Information from map and mention the POI", "solution": "To find the answer, You have to choose one POI name"}, "modules:input": "Question: What's the fastest driving route from D03 Flame Tree Ridge to Aster Cedars Hospital, Jebel Ali?\n\nOptions: (A) Via Hessa St/D61 (B) Via D57 (C) Via Garn Al Sabkha St/D59 (D) Via Al Asayel St/D72\n\nMetadata: {'skill': 'Fetch Information from map and mention the POI', 'solution': 'To find the answer, You have to choose one POI name'}\n\nModules: ", "modules:output": ["google_maps", "solution_generator", "answer_generator"], "response": "There are total 1 routes from D03 Flame Tree Ridge to Aster Cedars Hospital, Jebel Ali. The route information is provided below:\n\nRoute 1: VIA Garn Al Sabkha St/D59 will cover 24.1 km in 24 mins\nDetails steps are provided below: \nHead southwestRestricted usage road will cover 0.3 km in 1 min \nAt the roundabout, take the 2nd exit will cover 2.4 km in 4 mins \nAt the roundabout, take the 1st exitGo through 1 roundabout will cover 0.3 km in 1 min \nTurn left onto Al Fay Rd will cover 0.6 km in 1 min \nAt the roundabout, take the 2nd exit will cover 0.1 km in 1 min \nContinue onto Al Fay Rd will cover 0.4 km in 1 min \nTake the ramp to Al Khail Rd/E44 will cover 0.2 km in 1 min \nTake the ramp to Al Khail Rd/E44 will cover 0.5 km in 1 min \nContinue onto Al Khail Rd/E44 will cover 0.1 km in 1 min \nTake the E311 S/Sh Mohammed Bin Zayed Rd exit toward DWC Airport/Abu Dhabi will cover 1.4 km in 1 min \nSlight right onto the ramp to Garn Al Sabkha St/D59 will cover 0.9 km in 1 min \nTake the ramp to Garn Al Sabkha St/D59 will cover 1.4 km in 1 min \nKeep right at the fork to continue toward Garn Al Sabkha St/D59 will cover 0.3 km in 1 min \nContinue onto Garn Al Sabkha St/D59 will cover 3.7 km in 3 mins \nKeep left to stay on Garn Al Sabkha St/D59 will cover 1.7 km in 1 min \nMerge onto Sheikh Zayed Rd/E11 via the ramp to Jebel Ali/Abu Dhabi will cover 3.5 km in 2 mins \nContinue straight to stay on Sheikh Zayed Rd/E11Toll road will cover 2.3 km in 1 min \nTake exit 22 toward PJA Port Gate 1/PJA Port Gate 2 will cover 2.2 km in 2 mins \nKeep right will cover 1.8 km in 2 mins \nTurn right onto 511 Street\u200eDestination will be on the right will cover 0.1 km in 1 min \n\n", "query_generator:input": "What's the fastest driving route from D03 Flame Tree Ridge to Aster Cedars Hospital, Jebel Ali?\n\nOptions: (A) Via Hessa St/D61 (B) Via D57 (C) Via Garn Al Sabkha St/D59 (D) Via Al Asayel St/D72", "query_generator:output": "There are total 1 routes from D03 Flame Tree Ridge to Aster Cedars Hospital, Jebel Ali. The route information is provided below:\n\nRoute 1: VIA Garn Al Sabkha St/D59 will cover 24.1 km in 24 mins\nDetails steps are provided below: \nHead southwestRestricted usage road will cover 0.3 km in 1 min \nAt the roundabout, take the 2nd exit will cover 2.4 km in 4 mins \nAt the roundabout, take the 1st exitGo through 1 roundabout will cover 0.3 km in 1 min \nTurn left onto Al Fay Rd will cover 0.6 km in 1 min \nAt the roundabout, take the 2nd exit will cover 0.1 km in 1 min \nContinue onto Al Fay Rd will cover 0.4 km in 1 min \nTake the ramp to Al Khail Rd/E44 will cover 0.2 km in 1 min \nTake the ramp to Al Khail Rd/E44 will cover 0.5 km in 1 min \nContinue onto Al Khail Rd/E44 will cover 0.1 km in 1 min \nTake the E311 S/Sh Mohammed Bin Zayed Rd exit toward DWC Airport/Abu Dhabi will cover 1.4 km in 1 min \nSlight right onto the ramp to Garn Al Sabkha St/D59 will cover 0.9 km in 1 min \nTake the ramp to Garn Al Sabkha St/D59 will cover 1.4 km in 1 min \nKeep right at the fork to continue toward Garn Al Sabkha St/D59 will cover 0.3 km in 1 min \nContinue onto Garn Al Sabkha St/D59 will cover 3.7 km in 3 mins \nKeep left to stay on Garn Al Sabkha St/D59 will cover 1.7 km in 1 min \nMerge onto Sheikh Zayed Rd/E11 via the ramp to Jebel Ali/Abu Dhabi will cover 3.5 km in 2 mins \nContinue straight to stay on Sheikh Zayed Rd/E11Toll road will cover 2.3 km in 1 min \nTake exit 22 toward PJA Port Gate 1/PJA Port Gate 2 will cover 2.2 km in 2 mins \nKeep right will cover 1.8 km in 2 mins \nTurn right onto 511 Street\u200eDestination will be on the right will cover 0.1 km in 1 min \n\n", "solution": "The fastest driving route from D03 Flame Tree Ridge to Aster Cedars Hospital, Jebel Ali is Via Garn Al Sabkha St/D59.\n\nTherefore, the answer is C.", "solution_generator:input": "Question: What's the fastest driving route from D03 Flame Tree Ridge to Aster Cedars Hospital, Jebel Ali?\n\nOptions: (A) Via Hessa St/D61 (B) Via D57 (C) Via Garn Al Sabkha St/D59 (D) Via Al Asayel St/D72\n\nMetadata: {'skill': 'Fetch Information from map and mention the POI', 'solution': 'To find the answer, You have to choose one POI name'}\n\nThere are total 1 routes from D03 Flame Tree Ridge to Aster Cedars Hospital, Jebel Ali. The route information is provided below:\n\nRoute 1: VIA Garn Al Sabkha St/D59 will cover 24.1 km in 24 mins\nDetails steps are provided below: \nHead southwestRestricted usage road will cover 0.3 km in 1 min \nAt the roundabout, take the 2nd exit will cover 2.4 km in 4 mins \nAt the roundabout, take the 1st exitGo through 1 roundabout will cover 0.3 km in 1 min \nTurn left onto Al Fay Rd will cover 0.6 km in 1 min \nAt the roundabout, take the 2nd exit will cover 0.1 km in 1 min \nContinue onto Al Fay Rd will cover 0.4 km in 1 min \nTake the ramp to Al Khail Rd/E44 will cover 0.2 km in 1 min \nTake the ramp to Al Khail Rd/E44 will cover 0.5 km in 1 min \nContinue onto Al Khail Rd/E44 will cover 0.1 km in 1 min \nTake the E311 S/Sh Mohammed Bin Zayed Rd exit toward DWC Airport/Abu Dhabi will cover 1.4 km in 1 min \nSlight right onto the ramp to Garn Al Sabkha St/D59 will cover 0.9 km in 1 min \nTake the ramp to Garn Al Sabkha St/D59 will cover 1.4 km in 1 min \nKeep right at the fork to continue toward Garn Al Sabkha St/D59 will cover 0.3 km in 1 min \nContinue onto Garn Al Sabkha St/D59 will cover 3.7 km in 3 mins \nKeep left to stay on Garn Al Sabkha St/D59 will cover 1.7 km in 1 min \nMerge onto Sheikh Zayed Rd/E11 via the ramp to Jebel Ali/Abu Dhabi will cover 3.5 km in 2 mins \nContinue straight to stay on Sheikh Zayed Rd/E11Toll road will cover 2.3 km in 1 min \nTake exit 22 toward PJA Port Gate 1/PJA Port Gate 2 will cover 2.2 km in 2 mins \nKeep right will cover 1.8 km in 2 mins \nTurn right onto 511 Street\u200eDestination will be on the right will cover 0.1 km in 1 min \n\n\n\nSolution: ", "solution_generator:output": "The fastest driving route from D03 Flame Tree Ridge to Aster Cedars Hospital, Jebel Ali is Via Garn Al Sabkha St/D59.\n\nTherefore, the answer is C.", "prediction": "Via Garn Al Sabkha St/D59", "answer_generator:input": "The fastest driving route from D03 Flame Tree Ridge to Aster Cedars Hospital, Jebel Ali is Via Garn Al Sabkha St/D59.\n\nTherefore, the answer is C.", "answer_generator:output": "Via Garn Al Sabkha St/D59", "true_false": false}
